{
  "slug": "base-gtm",
  "kind": "foundation",
  "outcome": "The shared accounts/contacts schema and credit-based connectors every other cookbook imports by handle",
  "chain": null,
  "state": "to-be-approved",
  "approval": { "demoWorkspace": null, "implementations": [] },
  "inputs": [],
  "doneWhen": [
    "`accounts` and `contacts` appear as models in the workspace, filed under the GTM folder",
    "neither model has a credential configured: base-gtm deploys zero-config on a fresh workspace"
  ],
  "cost": {
    "note": "Nothing. Native models and adopted connectors; credits are only spent by the cookbooks stacked on top."
  },
  "composesInto": [
    "tam-building",
    "list-building",
    "gtm-knowledge-graph",
    "pipeline-health",
    "signal-based-tam"
  ]
}
